post_id,title,subreddit,score,num_comments,author,collected_at,engagement,is_popular
1s8ua7r,"Iran Threatens to Attack U.S. Tech Companies Starting April 1 / Iran says it will target Apple, Google, and Microsoft, among others.",technology,4878,662,MarvelsGrantMan136,2026-04-01 01:42:19,0.13568354170936667,True
1s8pxfm,Gmail now lets you change your old email name without deleting account,technology,4095,323,Dilpickle2113,2026-04-01 01:42:19,0.078857421875,True
1s8v18p,"Iran says will target US firms in West Asia starting Apr 1; Microsoft, Google, Apple on list of 18: 'Expect destruction'",technology,2173,474,kungfuninjaa,2026-04-01 01:42:19,0.21803127874885003,False
1s8w6vg,Judge blocks executive order to end federal funding for PBS and NPR,technology,1371,50,cmaia1503,2026-04-01 01:42:19,0.03644314868804665,False
1s8tf8d,Jury finds Meta and YouTube negligent in landmark lawsuit on social media safety,technology,917,54,IKeepItLayingAround,2026-04-01 01:42:19,0.058823529411764705,False
1s8xb9v,"OkCupid gave 3 million dating-app photos to facial recognition firm, FTC says",technology,534,26,nimicdoareu,2026-04-01 01:42:19,0.048598130841121495,False
1s8a0vi,FBI Confirms Kash Patel Email Hack as US Offers $10M Reward for Hackers,technology,16912,784,Choobeen,2026-04-01 01:42:19,0.04635487494826465,True
1s8kx13,New York Times Cuts Ties With Book Review Writer Over AI Use,technology,1149,70,IKeepItLayingAround,2026-04-01 01:42:19,0.06086956521739131,False
1s8e4m5,Iran War Chokes Off Helium Supply Critical for AI,technology,3779,186,CommercialMassive751,2026-04-01 01:42:19,0.049206349206349205,True
1s8keyn,Apple reveals it bowed to Kremlin pressure to remove 190 apps from Russian App Store over three years,technology,1182,70,duckanroll,2026-04-01 01:42:19,0.05917159763313609,False
1s8r1i6,Oracle cutting thousands in latest layoff round as company continues to ramp AI spending,technology,454,69,MarvelsGrantMan136,2026-04-01 01:42:19,0.15164835164835164,False
1s8xgm6,"Entire Claude Code CLI source code leaks thanks to exposed map file | 512,000 lines of code that competitors and hobbyists will be studying for weeks.",technology,219,28,ControlCAD,2026-04-01 01:42:19,0.12727272727272726,False
1s846lp,YouTube chat logs reveal employees aimed for “viewer addiction” and scrapped safety tools,technology,17175,545,IndicaOatmeal,2026-04-01 01:42:19,0.03173032137866791,True
1s8kont,Toyota: 'Many Areas Where People Cannot Get By Without Gas Cars',technology,785,402,DonkeyFuel,2026-04-01 01:42:19,0.5114503816793893,False
1s8t69r,Art schools are being torn apart by AI,technology,239,150,No-Cockroach-6807,2026-04-01 01:42:19,0.625,False
1s8uk2j,Pro-AI group to spend $100mn on US midterm elections as backlash grows,technology,194,27,Just-Grocery-2229,2026-04-01 01:42:19,0.13846153846153847,False
1s8rz91,Chromebook Remorse: Tech Backlash at Schools Extends Beyond Phones | No more YouTube or video games on school laptops. Textbooks and pencils are back. Some seventh graders say they prefer learning offline,technology,209,47,Hrmbee,2026-04-01 01:42:19,0.22380952380952382,False
1s8k4vm,‘I Just Hope We Can Bounce Back’: GM’s Prized EV Truck Factory Goes Dark Again,technology,559,227,TripleShotPls,2026-04-01 01:42:19,0.40535714285714286,False
1s8q066,"Students in China are renting smart glasses to cheat on exams, and it's surprisingly easy",technology,215,48,Federal-Block-3275,2026-04-01 01:42:19,0.2222222222222222,False
1s849kh,UFC Boss Tells Fans To ‘Shut The F**k Up’ About AI Slop Ads And Just ‘Watch The Fights’,technology,5197,450,esporx,2026-04-01 01:42:19,0.08657175836860331,True
1s86jin,Students Are Now Renting Smart Glasses to Cheat on Exams,technology,3106,296,dapperlemon,2026-04-01 01:42:19,0.09526874798841325,False
1s82vn1,Microsoft plans 100% native Windows 11 apps in major shift away from web wrappers,technology,4994,523,renome,2026-04-01 01:42:19,0.1047047047047047,True
1s8j69h,AI Slop Is Destroying the Internet. These Are the People Fighting to Save It,technology,366,39,sr_local,2026-04-01 01:42:19,0.10626702997275204,False
1s8mara,"Americans are using AI more, but fear of job losses is growing",technology,189,81,AdSpecialist6598,2026-04-01 01:42:19,0.4263157894736842,False
1s8ps9t,EPA Tells Diesel Engine Makers to Ditch One of the Most Unreliable Emissions Components,technology,96,24,TripleShotPls,2026-04-01 01:42:19,0.24742268041237114,False
1s8d08b,"/r/WorldNews Live Thread: Russian Invasion of Ukraine Day 1496, Part 1 (Thread #1643)",worldnews,398,88,WorldNewsMods,2026-04-01 01:42:23,0.22055137844611528,False
1s402bg,/r/WorldNews Discussion Thread: US and Israel launch attack on Iran; Iran retaliates (Thread #11),worldnews,244,5950,WorldNewsMods,2026-04-01 01:42:23,24.285714285714285,False
1s8mtmu,"""Go Get Your Own Oil"": Trump's Message To UK, Other Countries On Hormuz Strait",worldnews,16128,2273,Zealousideal_Ring_67,2026-04-01 01:42:23,0.1409262818525637,True
1s8lnr7,Trump warns UK ‘US won’t be there to help you anymore’ in extraordinary tirade over Iran war backing,worldnews,14901,2817,Gopu_17,2026-04-01 01:42:23,0.18903502885518722,True
1s8jnlk,Poland says ‘no’ to sending Patriot missile launcher to help US fight Iran,worldnews,19057,613,Auspectress,2026-04-01 01:42:23,0.03216497009130024,True
1s8m73a,France refused Israel use of its air space to transfer US weapons for Iran war - sources,worldnews,7335,225,Dizzy_Industry1287,2026-04-01 01:42:23,0.030670665212649946,True
1s8hq5u,"Italy Denies US Aircraft Access to Military Base, Corriere Says",worldnews,13307,527,Accurate_Cry_8937,2026-04-01 01:42:23,0.03960024045686805,True
1s8t20b,"Iran war sparks renewables boom as Europeans rush to buy solar, heat pumps and EVs",worldnews,1711,110,iwantboringtimes,2026-04-01 01:42:23,0.06425233644859812,False
1s8ns6w,"Israel to destroy 'all houses' near Lebanon border, defence minister says",worldnews,2975,631,TrinketSmasher,2026-04-01 01:42:23,0.21202956989247312,False
1s8n13h,White House: Reopening Strait of Hormuz Not Vital to Ending Iran War,worldnews,3082,588,Cultural-Avocado-184,2026-04-01 01:42:23,0.1907233214401557,False
1s8tm7s,Hegseth Says U.S. Will 'Negotiate With Bombs' Until Iran Cease-Fire Deal Is Reached,worldnews,1354,274,Editor_91,2026-04-01 01:42:23,0.2022140221402214,False
1s8ntkh,Leaked Calls Expose Hungary and Slovakia as Secret Kremlin Backchannel Inside EU,worldnews,1639,48,TheDarthSnarf,2026-04-01 01:42:23,0.02926829268292683,False
1s8vs5g,China and Pakistan present new Iran deal: Ceasefire for opening Hormuz,worldnews,638,152,no_technique,2026-04-01 01:42:23,0.2378716744913928,False
1s8x62a,"Trump tells Britain 'go get your own oil’ and Hegseth mocks 'big, bad Royal Navy' in latest attacks over Iran war",worldnews,528,193,PadyEos,2026-04-01 01:42:23,0.3648393194706994,False
1s8k9dp,Mexico demands answers after another migrant dies in ICE custody,worldnews,2033,44,S00THING_S0UNDS,2026-04-01 01:42:23,0.021632251720747297,False
1s8q4hm,"Russia demands Ukraine withdraw from Donbas within 2 months, Zelensky says",worldnews,899,140,EsperaDeus,2026-04-01 01:42:23,0.15555555555555556,False
1s8lioq,Iran sets giant oil tanker ablaze off Dubai after Trump warnings,worldnews,1509,223,Little-Chemical5006,2026-04-01 01:42:23,0.147682119205298,False
1s8caue,"The United States has struck a major ammunition depot in the Iranian city of Isfahan using 2,000-pound bunker-buster bombs",worldnews,5920,604,WayOutbackBoy,2026-04-01 01:42:23,0.10200979564262794,True
1s8e6g4,Giant oil tanker off Dubai hit by Iranian strike after Trump's latest threats,worldnews,3849,461,monotvtv,2026-04-01 01:42:23,0.11974025974025974,True
1s8qbhg,IRGC threatens strikes on US tech giants across the Middle East,worldnews,579,253,I_Hate_E_Daters_7007,2026-04-01 01:42:23,0.4362068965517241,False
1s8k03k,Chinese banned from buying flats for dead relatives’ ashes,worldnews,970,59,TheTelegraph,2026-04-01 01:42:23,0.0607621009268795,False
1s8ee5q,"Ukraine to help open Strait of Hormuz as part of Gulf weapons deals, Zelensky says",worldnews,2563,382,St_Gregory_Nazianzus,2026-04-01 01:42:23,0.14898595943837753,False
1s8n987,"Russian spy network in Kyiv foiled before planned assassinations of military, volunteers",worldnews,573,8,AdSpecialist6598,2026-04-01 01:42:23,0.013937282229965157,False
1s882oy,Iran's strike wounded over a dozen U.S. personnel and hit valuable jets in Saudi Arabia,worldnews,6728,487,callsonreddit,2026-04-01 01:42:23,0.07237330955565463,True
1s8mbl4,New audio recording reveals Hungarian FM promising Lavrov assistance on sanctions,worldnews,598,23,Hoihe,2026-04-01 01:42:23,0.038397328881469114,False
1bfpxfw,Welcome to /r/sports!,sports,94,49,caindaddy,2026-04-01 01:42:27,0.5157894736842106,False
1s8pmov,Tiger Woods told authorities he was looking at phone before crash,sports,823,176,PrincessBananas85,2026-04-01 01:42:27,0.21359223300970873,False
1s8tp1x,"Olivier Rioux, Florida's 7-foot-9 center, enters transfer portal",sports,400,142,Catt_al,2026-04-01 01:42:27,0.3541147132169576,False
1s8sxva,[World Record] 174 Skydivers In A Head-Down Formation,sports,190,31,redbullgivesyouwings,2026-04-01 01:42:27,0.16230366492146597,False
1s8ozrj,Haruki Hosono Throws No-Hitter for Hokkaido Nippon-Ham Fighters in Home Opener,sports,160,12,HeStoleMyBalloons,2026-04-01 01:42:27,0.07453416149068323,False
1s7xd26,Dane Jackson flipping into the water,sports,5780,153,redbullgivesyouwings,2026-04-01 01:42:27,0.026466009340944473,True
1s8syp0,"New York Jets HC Aaron Glenn on Geno Smith: ""He's the guy that's going to lead us to the promised land.""",sports,61,51,lemonstone92,2026-04-01 01:42:27,0.8225806451612904,False
1s8gpw0,Mel Barcena’s strike into the net for San Diego Wave,sports,266,8,ElectricalWriting,2026-04-01 01:42:27,0.0299625468164794,False
1s899pt,Toronto Maple Leafs fire general manager Brad Treliving,sports,457,30,Puginator,2026-04-01 01:42:27,0.06550218340611354,False
1s82dej,Male athletes file Title IX lawsuit against California college,sports,823,98,RhythmMethodMan,2026-04-01 01:42:27,0.11893203883495146,False
1s83uco,"NFL set to begin hiring and training replacement officials, AP sources say",sports,626,121,gamersecret2,2026-04-01 01:42:27,0.19298245614035087,False
1s7we5d,Florida Attorney General Demands That NFL Remove Rooney Rule,sports,879,229,RollingMoss1,2026-04-01 01:42:27,0.26022727272727275,False
1s7oufm,New York Marathon winner Albert Korir banned 5 years for doping,sports,1603,135,PrincessBananas85,2026-04-01 01:42:27,0.08416458852867831,False
1s7ah7o,#2 UConn G Braylon Mullins Hits the Game-Winning 3 at the Final Second vs #1 Duke!,sports,11970,645,JCameron181,2026-04-01 01:42:27,0.05388021050872943,True
1s7fo7m,"UConn G Braylon Mullins, Who Hit the Game-Winning 3 vs #1 Duke, Reveals He Thought It Was for the Tie",sports,1033,56,JCameron181,2026-04-01 01:42:27,0.05415860735009671,False
1s7iuzd,Melbourne Football Club turn around a 43 point deficit to defeat the Carlton Blues by 23 points.,sports,432,57,Pleasant_Inspection9,2026-04-01 01:42:27,0.13163972286374134,False
1s6r9tu,"Ketel Marte tags Freddie Freeman out, with a hug",sports,6195,101,WorthPlease,2026-04-01 01:42:27,0.01630083925112976,True
1s7129v,Tiger Woods is facing an uncertain future off the golf course after his DUI arrest in Florida,sports,1083,231,Express-Citron-6387,2026-04-01 01:42:27,0.21309963099630996,False
1s75hzl,American billionaires including the Waltons are splashing their cash on Indian cricket teams.,sports,528,52,JKKIDD231,2026-04-01 01:42:27,0.09829867674858223,False
1s6jtd8,Former champion Alexa Grasso brutally KOs Maycee Barber,sports,17435,701,ninjupX,2026-04-01 01:42:27,0.04020417526955724,True
1s6y2gh,Relegation-threatened Tottenham parts ways with interim coach Igor Tudor,sports,196,25,gamersecret2,2026-04-01 01:42:27,0.12690355329949238,False
1s78ly2,Anukul Roy pulled off a bullseye direct hit to get the run out | MI VS KKR | IPL 2026,sports,25,36,RodrickJasperHeffley,2026-04-01 01:42:27,1.3846153846153846,False
1s6jt2a,Floyd Mayweather pumps brakes on rematch with Manny Pacquiao,sports,625,72,PrincessBananas85,2026-04-01 01:42:27,0.11501597444089456,False
1s8lgb6,"People who complete more years of formal education tend to score lower on measures of right-wing authoritarianism, a trait characterized by strict obedience to leaders and adherence to traditional norms. A study of twins reveals that most of the link is explained by environments and genetics.",science,8862,636,mvea,2026-04-01 01:42:31,0.07175899808191358,True
1s8vquj,"Alcohol has been linked to 7 types of Cancer, including breast, colorectal, liver and throat cancers. Additionally, there is no ""safe"" level of alcohol consumption with regard to cancer risk. Alcohol leads to cancer by damaging DNA, disrupting hormones and/or creating unstable free radicals.",science,1884,247,freudian_nipps,2026-04-01 01:42:31,0.1310344827586207,False
1s8qihb,"Just a few minutes of intense daily activity, such as sprinting for a bus or briskly climbing stairs, could significantly reduce the risk of serious health conditions including arthritis, heart disease, and dementia, new research suggests",science,1599,25,Wagamaga,2026-04-01 01:42:31,0.015625,False
1s8spw0,"Vaping Comes With a Cancer Risk, Study Finds. Scientists found that cell DNA can be harmed by the compounds or byproducts of e-cigarettes, including flavoring agents and certain metals.",science,513,141,InsaneSnow45,2026-04-01 01:42:31,0.27431906614785995,False
1s8h533,"A new study suggests that large swings in when people go to bed could double the risk of serious cardiac events—particularly among those who get less than eight hours of sleep. By contrast, irregular wake-up times showed no clear link to cardiac events",science,2332,98,Wagamaga,2026-04-01 01:42:31,0.04200600085726532,False
1s8vyzi,Millions of preterm births and thousands of infant deaths linked to plastic chemical,science,327,6,marfes3,2026-04-01 01:42:31,0.018292682926829267,False
1s8m43a,"Only half of the calories produced on croplands are available for human consumption. The calories ‘lost’ to inefficiency (49.9%) is enough to support 7.2 billion people. 39.7% of the lost calories are from beef production, which requires 33 calories of feed for every calorie of boneless meat.",science,888,251,cindyx7102,2026-04-01 01:42:31,0.2823397075365579,False
1s84lpx,Strongest evidence yet that vaping likely causes cancer. The evidence shows nicotine-based vapes are likely to cause oral and lung cancer.,science,16374,1471,mvea,2026-04-01 01:42:31,0.08983206106870228,True
1s8lzf4,"Study identifies a direct connection inside the brain that links stress to addiction‑related behaviors, showing how alcohol disrupts the natural stress‑response system, making it harder for the brain to adapt or make good decisions",science,635,31,sr_local,2026-04-01 01:42:31,0.04874213836477988,False
1s8shot,Childhood trauma linked to elevated risk of simultaneous physical and mental illness in old age. Study found that childhood adversity strongly predicts the later coexistence of chronic physical diseases and clinical depression.,science,204,4,InsaneSnow45,2026-04-01 01:42:31,0.01951219512195122,False
1s8hg1b,"Asia now hub of growing illegal wildlife trade across 100+ countries. Research highlights the growth in illicit networks that now spiderweb across the globe: The number of countries involved more than doubled from 49 in 2000 to 110 in 2019, and trade connections jumped by more than 400%.",science,323,21,Wagamaga,2026-04-01 01:42:31,0.06481481481481481,False
1s7yso4,"Physicists have made an ultra-powerful magnet that fits in the palm of a hand and can produce a magnetic field that is more than 800,000 times stronger than Earth’s.",science,2858,290,MistWeaver80,2026-04-01 01:42:31,0.10143406785589366,False
1s8qkow,Exxon Scientists Had Doubts About Algae Biofuels. The Oil Giant Touted Them Anyway.,science,50,3,CommercialMassive751,2026-04-01 01:42:31,0.058823529411764705,False
1s7svna,Glyphosate: A common weedkiller may induce anxiety by disrupting gut bacteria. Researchers observed that rats drinking the chemical developed hypervigilance toward harmless objects and sounds. This altered behavior was accompanied by abnormal changes in a specific dread-inducing region of the brain.,science,4829,343,Tracheid,2026-04-01 01:42:31,0.07101449275362319,True
1s7maha,"ChatGPT acts as a ""cognitive crutch"" that weakens memory, new research suggests. While these tools can speed up initial learning, they might actually weaken the deep mental processing required to store knowledge over the long term.",science,17148,1040,mvea,2026-04-01 01:42:31,0.06064493556475596,True
1s7wjfc,"Heat linked to fewer male births in Africa, study finds",science,2781,147,Jojuj,2026-04-01 01:42:31,0.052839683680805175,False
1s7p8ji,"Exercise harder, not just longer, to reduce risk of disease and death. Short bursts of more intense activity have been found to be especially protective against inflammatory diseases, including arthritis, serious cardiovascular disease and dementia",science,4956,207,sr_local,2026-04-01 01:42:31,0.04175912850514424,True
1s8xdyp,Primary care data shows that recent-onset or multiple vitreous floaters are a more significant warning sign for retinal detachment than flashes,science,16,2,iamphilosofie,2026-04-01 01:42:31,0.11764705882352941,False
1s82d5f,"Beavers can turn rivers into powerful carbon sinks, storing up to ten times more carbon than unmodified streams. The 13-year study found that beaver-engineered wetlands in Switzerland sequestered 1,194 tonnes of carbon, primarily by trapping sediment and deadwood.",science,1007,18,Sciantifa,2026-04-01 01:42:31,0.017857142857142856,False
1s88ixh,"Wild animals act as ""landscape engineers"": A new meta-analysis shows how activities like burrowing and feeding accelerate the movement of soil and sediment by an average of 136% in freshwater and 66% in terrestrial ecosystems across the globe.",science,468,7,Sciantifa,2026-04-01 01:42:31,0.014925373134328358,False
1s7oo3f,"Scientists observe pairs of atoms existing in two places at once for the first time. In a new quantum physics experiment, researchers have shown that matter can experience entanglement – an effect Einstein dismissed as ‘spooky action at a distance’.",science,4302,196,mvea,2026-04-01 01:42:31,0.0455496165465954,True
1s8p4rz,"Seasonal variation and land-use patterns influence microplastic concentrations in freshwater systems, with research showing links between rainfall, human activity, and spatial distribution of microplastics in natural habitats",science,32,1,ChhotaSaHydra,2026-04-01 01:42:31,0.030303030303030304,False
1s8w1go,"Early life adversity, including stressful conditions like abuse or food insecurity, can increase cardiovascular risks, research shows",science,14,1,NGNResearch,2026-04-01 01:42:31,0.06666666666666667,False
1s7l2h9,"Covid-19 vaccines do not increase the risk of sudden cardiac death in younger healthy adults. In fact, people vaccinated against covid-19 were 43% less likely to experience sudden death than unvaccinated people (adjusted odds ratio 0.57 (95% confidence interval 0.53 to 0.61); P&lt;0.001).",science,4895,358,Wagamaga,2026-04-01 01:42:31,0.07312091503267974,True
1s8lt4z,"Genomic surveillance in Berlin, Germany, found that mpox virus clade Ib spread rapidly through local transmission from late 2025 to early 2026, with 35 genetically closely related cases identified | Eurosurveillance",science,42,1,nocdev,2026-04-01 01:42:31,0.023255813953488372,False
1nk2i7r,Full video of the monologue Jimmy Kimmel got cancelled for,entertainment,534,81,IntelligentDetail338,2026-04-01 01:42:35,0.15140186915887852,False
1s8uy1s,Army Suspends Aircrew After Bonkers Kid Rock Helicopter Stunt,entertainment,6592,465,T_Shurt,2026-04-01 01:42:35,0.0705293493098741,True
1s8xkze,"Judge Rules Trump’s Order to End Funding for PBS, NPR Was an Illegal First Amendment Violation",entertainment,551,27,icey_sawg0034,2026-04-01 01:42:35,0.04891304347826087,False
1s8ra3w,Tiger Woods Had Two Opioid Pills in His Pocket and 'Bloodshot and Glassy Eyes' When He Crashed,entertainment,619,127,PrincessBananas85,2026-04-01 01:42:35,0.20483870967741935,False
1s8lqeu,Paul McCartney temporarily banned from Reddit for posting photos from his own concert,entertainment,1026,158,AdSpecialist6598,2026-04-01 01:42:35,0.15384615384615385,False
1s8d85d,Jon Stewart Says Donald Trump’s Recent Behavior Is ‘Less “Commander-in-Chief at War” and More “Grandpa Who’s Lost His Filter in Public”’,entertainment,3347,39,MoneyLibrarian9032,2026-04-01 01:42:35,0.011648745519713262,True
1s8lyg2,Two young boys were detained by ICE. Then Ms. Rachel shared their stories.,entertainment,687,7,Large-Welcome4421,2026-04-01 01:42:35,0.010174418604651164,False
1s8j34l,"Zendaya Says She’s ‘Going Into Hiding’ After Huge 2026 With ‘The Drama,’ ‘Euphoria,’ ‘Spider-Man 4’ and More: ‘I Hope People Don’t Get Sick of Me’",entertainment,1053,241,mcfw31,2026-04-01 01:42:35,0.2286527514231499,False
1s8t3ab,"Beloved Actor William Daniels, Known for Role as Mr. Feeny, Turns 99 Years Old, Joking: 'Who Wants to Be 100?'",entertainment,212,38,mcfw31,2026-04-01 01:42:35,0.1784037558685446,False
1s83xy4,John Oliver launches free sticker site to cover Trump’s face on 2026 national park passes,entertainment,8510,146,sfgate,2026-04-01 01:42:35,0.0171542709434849,True
1s8dygb,Rob Schneider Urges the U.S. to “Restore the Military Draft” Amid Ongoing Iran War,entertainment,1911,798,normankrasnerkc,2026-04-01 01:42:35,0.41736401673640167,False
1s8sq6h,‘Supergirl’ Star Milly Alcock Says ‘I Really Can’t Stop’ Backlash and Understands Why Scorsese and Ridley Scott Criticized Superhero Movies: ‘Not Every Film Is for Everyone’,entertainment,173,44,cmaia1503,2026-04-01 01:42:35,0.25287356321839083,False
1s7wefg,Charles Barkley Goes Off-Script In March Madness To Call Out Trump ‘Disgrace’,entertainment,23785,312,huffpost,2026-04-01 01:42:35,0.013116959556041368,True
1s8sjaf,"Brendan Fraser says Rachel Weisz knew her ""The Mummy"" character even better than the casting directors did",entertainment,136,24,mrjohnnymac18,2026-04-01 01:42:35,0.17518248175182483,False
1s8p42p,John Oliver Selling Stickers to Hide Donald Trump’s Face on National Park Passes: Don’t ‘Look at the Guy Who’s Actively Trying to Ruin Them’,entertainment,189,7,MoneyLibrarian9032,2026-04-01 01:42:35,0.03684210526315789,False
1s7tmlm,MTG Turns on Fox News: Ex Rep Says Channel is ‘Brainwashing Boomers’ and Peddling ‘Fake News’,entertainment,15996,970,T_Shurt,2026-04-01 01:42:35,0.06063636931924736,True
1s85kj0,"TSA workers asked to return $1,000 gift cards given out by Tyler Perry at Atlanta airport",entertainment,2600,209,Miles_the_AuDHDer,2026-04-01 01:42:35,0.08035371011149559,False
1s8fc4z,Bob Dylan is selling AI-generated historical fan-fiction. The “Like a Rolling Stone” songwriter has launched a Patreon to regale fans with fictional AI monologues by historical figures for $5 a month.,entertainment,473,111,mlg1981,2026-04-01 01:42:35,0.23417721518987342,False
1s8pv5m,U.S. Army says it's investigating military helicopter flyby at Kid Rock's house,entertainment,93,15,Scary_Statement4612,2026-04-01 01:42:35,0.1595744680851064,False
1s7xgx8,US Army investigating attack helicopter photoshoot at Kid Rock's home,entertainment,3073,178,RawStoryNews,2026-04-01 01:42:35,0.057905009759271306,False
1s8qnh4,Jon Stewart Takes Up Trump’s Offer to Ask Him About Sex | The president made a bizarre offer to Saudi investors last week.,entertainment,51,2,InsaneSnow45,2026-04-01 01:42:35,0.038461538461538464,False
1s8xa4y,Bindi Irwin Reveals She's Had '50 Endometriosis Lesions Cut Out of My Body' in Past 3 Years,entertainment,25,1,AdSpecialist6598,2026-04-01 01:42:35,0.038461538461538464,False
1s84y2h,Why the ICE Raid in ‘The Pitt’ Matters,entertainment,1094,73,BulwarkOnline,2026-04-01 01:42:35,0.06666666666666667,False
1s8iq2m,All the times Paul McCartney has savagely slammed Trump after brutal show jab,entertainment,124,6,IrishStarUS,2026-04-01 01:42:35,0.048,False
1s8pe6f,"When Kid Rock was ‘Black’ - The rock-rap star got his start in hip-hop. Now, he’s unrecognizable to some of the people he came up with",entertainment,43,27,nimobo,2026-04-01 01:42:35,0.6136363636363636,False
